title,media,date,datetime,desc,link,img,Category
Semi-Autonomous Vehicle Market Demand To Reach 60.1 ...,,1 month ago,2021-08-04 21:13:53.454438,"Semi-autonomous cars also promise drivers the ability to practice safer driving over the forecast period, thus driving higher adoption. The availability of ...",https://www.prnewswire.com/news-releases/semi-autonomous-vehicle-market-demand-to-reach-60-1-million-units-by-2028-grand-view-research-inc-301338197.html,"data:image/gif;base64,R0lGODlhAQABAIAAAP///////yH5BAEKAAEALAAAAAABAAEAAAICTAEAOw==",Autonomous vehicles
Intel's Mobileye takes its autonomous vehicle testing program ...,TechCrunch,1 month ago,2021-08-04 21:13:53.457697,"Mobileye, a subsidiary of Intel, has expanded its autonomous vehicle testing program to New York City as part of its strategy to develop and deploy the ...",https://techcrunch.com/2021/07/20/intels-mobileye-takes-its-autonomous-vehicle-testing-program-to-new-york-city/,"data:image/gif;base64,R0lGODlhAQABAIAAAP///////yH5BAEKAAEALAAAAAABAAEAAAICTAEAOw==",Autonomous vehicles
Udacity Reinvents Autonomous Vehicle Education Again With ...,PR Newswire,1 month ago,2021-08-04 21:13:53.460904,Udacity Reinvents Autonomous Vehicle Education Again With New Iteration Of Iconic Program. Self-Driving Car Engineer Nanodegree Program Navigates New ...,https://www.prnewswire.com/news-releases/udacity-reinvents-autonomous-vehicle-education-again-with-new-iteration-of-iconic-program-301337624.html,"data:image/gif;base64,R0lGODlhAQABAIAAAP///////yH5BAEKAAEALAAAAAABAAEAAAICTAEAOw==",Autonomous vehicles
Intel's Mobileye begins testing autonomous vehicles in New ...,The Verge,1 month ago,2021-08-04 21:13:53.464069,"Mobileye, the company that specializes in chips for vision-based autonomous vehicles, is now testing its AVs in New York City — a difficult and rare move ...",https://www.theverge.com/2021/7/20/22585338/intel-mobileye-autonomous-vehicle-av-testing-nyc,"data:image/gif;base64,R0lGODlhAQABAIAAAP///////yH5BAEKAAEALAAAAAABAAEAAAICTAEAOw==",Autonomous vehicles
New algorithm may help autonomous vehicles navigate ...,,1 month ago,2021-08-04 21:13:53.467083,"Date: July 20, 2021; Source: Carnegie Mellon University; Summary: Autonomous vehicle researchers have tackled navigating a crowded, narrow street, with cars ...",https://www.sciencedaily.com/releases/2021/07/210720113956.htm,"data:image/gif;base64,R0lGODlhAQABAIAAAP///////yH5BAEKAAEALAAAAAABAAEAAAICTAEAOw==",Autonomous vehicles
Tesla Full-Self Driving Software Alarms Safety Advocates,,1 month ago,2021-08-04 21:13:53.470081,Tesla's 'Full Self-Driving' Beta Software Used on Public Roads Lacks Safeguards. Consumer Reports' car safety experts worry that Tesla continues to use vehicle ...,https://www.consumerreports.org/car-safety/tesla-full-self-driving-beta-software-lacks-safeguards-a6698414036/,"data:image/gif;base64,R0lGODlhAQABAIAAAP///////yH5BAEKAAEALAAAAAABAAEAAAICTAEAOw==",Autonomous vehicles
Why Not Use Self-Driving Cars as Supercomputers?,WIRED,1 month ago,2021-08-04 21:13:53.473246,"To do that, the vehicles are packed with computing power: Nvidia, which makes chips used in autonomous vehicles, says a self-driving car can have the equivalent ...",https://www.wired.com/story/use-self-driving-cars-supercomputers/,"data:image/gif;base64,R0lGODlhAQABAIAAAP///////yH5BAEKAAEALAAAAAABAAEAAAICTAEAOw==",Autonomous vehicles
Semi-autonomous vehicles: the short-term solution to restart ...,Automotive World,1 month ago,2021-08-04 21:13:53.476397,Semi-autonomous vehicles: the short-term solution to restart ride-sharing innovation. Mobility on-demand will offer the benefits of the autonomous vehicle ...,https://www.automotiveworld.com/articles/semi-autonomous-vehicles-the-short-term-solution-to-restart-ride-sharing-innovation/,"data:image/gif;base64,R0lGODlhAQABAIAAAP///////yH5BAEKAAEALAAAAAABAAEAAAICTAEAOw==",Autonomous vehicles
Robotaxis: have Google and Amazon backed the wrong ...,Financial Times,1 month ago,2021-08-04 21:13:53.872563,"Sign up to myFT Daily Digest to be the first to know about Driverless vehicles news. Since Google launched its self-driving car project in 2009, the biggest ...",https://www.ft.com/content/46ff4fe4-0ae6-4f68-902c-3fd14d294d72,"data:image/gif;base64,R0lGODlhAQABAIAAAP///////yH5BAEKAAEALAAAAAABAAEAAAICTAEAOw==",Autonomous vehicles
Mercedes to launch self-driving feature for the German autobahn,Fortune,1 month ago,2021-08-04 21:13:53.876109,Mercedes plans autumn launch of self-driving feature for the Autobahn ... to transform a conventional car into an autonomous vehicle into different stages.,https://fortune.com/2021/07/16/mercedes-auto-driving-autobahn-germany/,"data:image/gif;base64,R0lGODlhAQABAIAAAP///////yH5BAEKAAEALAAAAAABAAEAAAICTAEAOw==",Autonomous vehicles
Self-driving startup Aurora will raise $2 billion in SPAC merger,The Verge,1 month ago,2021-08-04 21:13:53.879576,"Self-driving technology startup Aurora, which was founded by the former head of Google's autonomous vehicle program, is the latest company to announce that ...",https://www.theverge.com/2021/7/15/22578959/autonomous-vehcile-aurora-spac-merger-reid-hoffman-mark-pincus,"data:image/gif;base64,R0lGODlhAQABAIAAAP///////yH5BAEKAAEALAAAAAABAAEAAAICTAEAOw==",Autonomous vehicles
SPACs keep rolling as autonomous vehicle startup Aurora ...,TechCrunch,1 month ago,2021-08-04 21:13:53.882968,"Aurora Innovation, the autonomous vehicle startup that acquired Uber's self-driving unit in December, is going public via a merger with special purpose ...",https://techcrunch.com/2021/07/15/spacs-keep-rolling-as-autonomous-vehicle-startup-aurora-targets-blank-check-debut-with-13b-valuation/,"data:image/gif;base64,R0lGODlhAQABAIAAAP///////yH5BAEKAAEALAAAAAABAAEAAAICTAEAOw==",Autonomous vehicles
Autonomous driving start-up Aurora plans to go public through ...,CNBC,1 month ago,2021-08-04 21:13:53.887010,"Autonomous driving start-up Aurora plans to go public through SPAC deal with initial value of $11 billion. Published Thu, Jul 15 202112:11 PM EDT Updated Thu, ...",https://www.cnbc.com/2021/07/15/autonomous-driving-start-up-aurora-plans-to-go-public-through-spac-deal-.html,"data:image/gif;base64,R0lGODlhAQABAIAAAP///////yH5BAEKAAEALAAAAAABAAEAAAICTAEAOw==",Autonomous vehicles
Toyota strengthens autonomous vehicle play with Carmera ...,The Robot Report,1 month ago,2021-08-04 21:13:53.890800,"Some of Carmera's earliest customers included Baidu, which used the technology for its open-source Apollo mapping project, and autonomous vehicle startup Voyage ...",https://www.therobotreport.com/toyota-strengthens-autonomous-vehicle-play-carmera-acquisition/,"data:image/gif;base64,R0lGODlhAQABAIAAAP///////yH5BAEKAAEALAAAAAABAAEAAAICTAEAOw==",Autonomous vehicles
How Germany Hopes to Get the Edge in Driverless Technology,The New York Times,1 month ago,2021-08-04 21:13:53.894615,"In technical jargon, the new law allows Level 4 autonomous driving, in which a vehicle can steer and navigate by itself most of the time but may occasionally ...",https://www.nytimes.com/2021/07/14/business/germany-autonomous-driving-new-law.html,"data:image/gif;base64,R0lGODlhAQABAIAAAP///////yH5BAEKAAEALAAAAAABAAEAAAICTAEAOw==",Autonomous vehicles
Volkswagen's new business strategy puts software and ...,TechCrunch,1 month ago,2021-08-04 21:13:53.897944,"Volkswagen also has big plans for autonomous driving. The company wants to take a chunk of the market share from ridesharing and car rental, and it sees an ...",https://techcrunch.com/2021/07/13/volkswagens-new-business-strategy-puts-software-and-autonomous-driving-front-and-center/,"data:image/gif;base64,R0lGODlhAQABAIAAAP///////yH5BAEKAAEALAAAAAABAAEAAAICTAEAOw==",Autonomous vehicles
10 Best Self Driving Car Stocks to Invest In,Yahoo Finance,1 month ago,2021-08-04 21:13:53.901261,"Only a decade ago, the idea of seeing driverless cars roaming about on the ... Electric and autonomous vehicles are gradually beginning to take over the ...",https://finance.yahoo.com/news/10-best-self-driving-car-141450159.html,"data:image/gif;base64,R0lGODlhAQABAIAAAP///////yH5BAEKAAEALAAAAAABAAEAAAICTAEAOw==",Autonomous vehicles
Hyperdrive Daily: Autonomous-Vehicle Startups Take the ...,Bloomberg.com,"Jul 9, 2021",2021-07-09 00:00:00.000000,"Wall Street is abuzz with autonomous-vehicle startups trying to go public. Argo AI, the self-driving upstart backed by Ford and Volkswagen, has hired banks ...",https://www.bloomberg.com/news/newsletters/2021-07-09/hyperdrive-daily-autonomous-vehicle-startups-take-the-money-keep-the-training-wheels,"data:image/gif;base64,R0lGODlhAQABAIAAAP///////yH5BAEKAAEALAAAAAABAAEAAAICTAEAOw==",Autonomous vehicles
Startup Halo will bring driverless car service to Las Vegas ...,The Verge,"Jul 8, 2021",2021-07-08 00:00:00.000000,"The idea is simple enough: Halo employs remote drivers to operate the vehicles, delivering them to waiting customers who then get behind the wheel and take the ...",https://www.theverge.com/2021/7/8/22568437/halo-driverless-car-tmobile-5g-las-vegas,"data:image/gif;base64,R0lGODlhAQABAIAAAP///////yH5BAEKAAEALAAAAAABAAEAAAICTAEAOw==",Autonomous vehicles
Elon Musk: Tesla will launch its 'mind-blowing' Full Self ...,Electrek,"Jul 8, 2021",2021-07-08 00:00:00.000000,"It's not considered autonomous driving yet because the driver is still responsible for the vehicle and needs to be ready to take control at all times, ...",https://electrek.co/2021/07/08/elon-musk-tesla-launch-mind-blowing-full-self-driving-beta-v9-saturday/,"data:image/gif;base64,R0lGODlhAQABAIAAAP///////yH5BAEKAAEALAAAAAABAAEAAAICTAEAOw==",Autonomous vehicles
This 5G-controlled car will roll up and expect you to drive,Fast Company,"Jul 8, 2021",2021-07-08 00:00:00.000000,"The cars omit the expensive lidar sensors in most autonomous vehicles. “You have better vision as a remote pilot than actually sitting inside the car,” ...",https://www.fastcompany.com/90653650/halo-driverless-car-sharing-service,"data:image/gif;base64,R0lGODlhAQABAIAAAP///////yH5BAEKAAEALAAAAAABAAEAAAICTAEAOw==",Autonomous vehicles
Moving autonomous vehicles from R&D to mass production is ...,VentureBeat,"Jul 8, 2021",2021-07-08 00:00:00.000000,"Presented by Pony.ai. The vision of safe, reliable autonomous vehicle transportation at scale is closer than ever to being realized, says James Peng, ...",https://venturebeat.com/2021/07/06/moving-autonomous-vehicles-from-rd-to-mass-production-is-closer-than-you-think/,"data:image/gif;base64,R0lGODlhAQABAIAAAP///////yH5BAEKAAEALAAAAAABAAEAAAICTAEAOw==",Autonomous vehicles
"Welcome to Simulation City, the virtual world where Waymo ...",The Verge,"Jul 6, 2021",2021-07-06 00:00:00.000000,"Waymo is unique among autonomous vehicle operators in that it has not one but two simulation programs it uses to train its vehicles. The first is CarCraft, ...",https://www.theverge.com/2021/7/6/22565448/waymo-simulation-city-autonomous-vehicle-testing-virtual,"data:image/gif;base64,R0lGODlhAQABAIAAAP///////yH5BAEKAAEALAAAAAABAAEAAAICTAEAOw==",Autonomous vehicles
Elon Musk just now realizing that self-driving cars are a 'hard ...,The Verge,"Jul 5, 2021",2021-07-05 00:00:00.000000,Tesla CEO Elon Musk is finally admitting that he underestimated how difficult it is to develop a safe and reliable self-driving car. To which the entire ...,https://www.theverge.com/2021/7/5/22563751/tesla-elon-musk-full-self-driving-admission-autopilot-crash,"data:image/gif;base64,R0lGODlhAQABAIAAAP///////yH5BAEKAAEALAAAAAABAAEAAAICTAEAOw==",Autonomous vehicles
France Is Preparing For The Arrival Of Autonomous Driving,CleanTechnica,"Jul 4, 2021",2021-07-04 00:00:00.000000,The decree also stated that the driver of the automated vehicle will be released from criminal liability as long as the automated driving system operates in ...,https://cleantechnica.com/2021/07/04/france-is-preparing-for-the-arrival-of-autonomous-driving/,"data:image/gif;base64,R0lGODlhAQABAIAAAP///////yH5BAEKAAEALAAAAAABAAEAAAICTAEAOw==",Autonomous vehicles
Infographic: Anticipating the Driverless Future of Vehicles,,"Jul 3, 2021",2021-07-03 00:00:00.000000,"With the rapid rise of electric vehicles (EVs) and increased investments in autonomous driving, what was once the future of vehicles is quickly becoming a ...",https://www.visualcapitalist.com/anticipating-the-driverless-future-of-vehicles/,"data:image/gif;base64,R0lGODlhAQABAIAAAP///////yH5BAEKAAEALAAAAAABAAEAAAICTAEAOw==",Autonomous vehicles
Ghost raises $100M Series D for autonomous driving and ...,TechCrunch,"Jul 1, 2021",2021-07-01 00:00:00.000000,The system is premised on the idea that an autonomous driving system doesn't need to recognize and categorize objects prior to avoiding them – a major paradigm ...,https://techcrunch.com/2021/07/01/ghost-raises-100m-series-d-for-autonomous-driving-and-crash-prevention-tech/,"data:image/gif;base64,R0lGODlhAQABAIAAAP///////yH5BAEKAAEALAAAAAABAAEAAAICTAEAOw==",Autonomous vehicles
"Autonomous/Driverless Car Market - Growth, Trends, COVID ...",Yahoo Finance,"Jul 1, 2021",2021-07-01 00:00:00.000000,"The autonomous (driverless) car market was valued at USD 20. ... The principal components of autonomous vehicles are sensors and cameras, Lidar acts as an ...",https://finance.yahoo.com/news/autonomous-driverless-car-market-growth-145300015.html,"data:image/gif;base64,R0lGODlhAQABAIAAAP///////yH5BAEKAAEALAAAAAABAAEAAAICTAEAOw==",Autonomous vehicles
Why Self-Driving Car Companies Need To Focus On Safety ...,Crunchbase News,"Jul 1, 2021",2021-07-01 00:00:00.000000,"When it comes to the autonomous automotive industry, consolidation is increasingly becoming the name of the game. As investors, consumers and founders alike ...",https://news.crunchbase.com/news/why-self-driving-car-companies-need-to-focus-on-safety-to-succeed/,"data:image/gif;base64,R0lGODlhAQABAIAAAP///////yH5BAEKAAEALAAAAAABAAEAAAICTAEAOw==",Autonomous vehicles
Autonomous vehicle bill arrives into Florida statutes,Florida Politics,"Jun 30, 2021",2021-06-30 00:00:00.000000,Driverless vehicles could start delivery as soon as this week. A new Florida law could now pave the way for driverless delivery in the state. Gov. Ron DeSantis ...,https://floridapolitics.com/archives/438658-autonomous-vehicle-delivery-pulls-into-florida-statute-books/,"data:image/gif;base64,R0lGODlhAQABAIAAAP///////yH5BAEKAAEALAAAAAABAAEAAAICTAEAOw==",Autonomous vehicles
Amazon Goes All-In On Truck Safety With Autonomous Driving ...,Forbes,"Jun 30, 2021",2021-06-30 00:00:00.000000,Today we'll look at some big moves the company is making in the autonomous vehicle (AV) realm with another company I follow closely: Plus.,https://www.forbes.com/sites/patrickmoorhead/2021/06/30/amazon-goes-all-in-on-truck-safety-with-autonomous-driving-company-plus/,"data:image/gif;base64,R0lGODlhAQABAIAAAP///////yH5BAEKAAEALAAAAAABAAEAAAICTAEAOw==",Autonomous vehicles
Autonomous car makers must report crashes to federal ...,Fortune,"Jun 29, 2021",2021-06-29 00:00:00.000000,The U.S. government's highway safety agency has ordered automakers to report any crashes involving fully autonomous vehicles or partially automated driver ...,https://fortune.com/2021/06/29/autonomous-car-makers-report-crashes-federal-government/,"data:image/gif;base64,R0lGODlhAQABAIAAAP///////yH5BAEKAAEALAAAAAABAAEAAAICTAEAOw==",Autonomous vehicles
Car companies will have to report automated vehicle crashes ...,The Verge,"Jun 29, 2021",2021-06-29 00:00:00.000000,"Level 5 refers to a fully autonomous vehicle that can travel anywhere, under any ... government is closely overseeing the safety of automated vehicles.”.",https://www.theverge.com/2021/6/29/22555666/nhtsa-autonomous-vehicle-crash-report-data,"data:image/gif;base64,R0lGODlhAQABAIAAAP///////yH5BAEKAAEALAAAAAABAAEAAAICTAEAOw==",Autonomous vehicles
Hyperdrive Daily: A Car Prang Made Me Reflect on Self-Driving,Bloomberg.com,"Jun 28, 2021",2021-06-28 00:00:00.000000,"Autonomous driving requires a leap of faith, something that was brought home to me recently when I was in a (minor, thankfully) car accident.",https://www.bloomberg.com/news/newsletters/2021-06-28/hyperdrive-daily-a-car-prang-made-me-reflect-on-self-driving,"data:image/gif;base64,R0lGODlhAQABAIAAAP///////yH5BAEKAAEALAAAAAABAAEAAAICTAEAOw==",Autonomous vehicles
Apple's car obsession is all about taking eyes off the road,Los Angeles Times,"Jun 25, 2021",2021-06-25 00:00:00.000000,"A driverless car made by Waymo, Alphabet's self-driving car division. Alphabet, Amazon and Apple are competing to win the mass market for autonomous ...",https://www.latimes.com/business/technology/story/2021-06-25/apples-car-obsession-is-all-about-taking-eyes-off-the-road,"data:image/gif;base64,R0lGODlhAQABAIAAAP///////yH5BAEKAAEALAAAAAABAAEAAAICTAEAOw==",Autonomous vehicles
Tech Giants Make Push Into Autonomous Driving,Transport Topics,"Jun 25, 2021",2021-06-25 00:00:00.000000,Tech Giants Make Push Into Autonomous Driving. Zoox vehicle A Zoox self-driving car at the company's headquarters in California. (Michael Short/ ...,https://www.ttnews.com/articles/tech-giants-make-push-autonomous-driving,"data:image/gif;base64,R0lGODlhAQABAIAAAP///////yH5BAEKAAEALAAAAAABAAEAAAICTAEAOw==",Autonomous vehicles
Who is at Fault in Accidents Involving Autonomous Cars?,National Law Review,"Jun 25, 2021",2021-06-25 00:00:00.000000,Google's self-driving car first crashed into a bus in February of 2016; there were no injuries. Tesla autonomous vehicles have been involved in several ...,https://www.natlawreview.com/article/driverless-car-accidents-who-s-fault,"data:image/gif;base64,R0lGODlhAQABAIAAAP///////yH5BAEKAAEALAAAAAABAAEAAAICTAEAOw==",Autonomous vehicles
A $5 Billion Boost For Autonomous Vehicles,The Motley Fool,"Jun 25, 2021",2021-06-25 00:00:00.000000,GM is the auto manufacturing expert with a massive financing arm. Cruise is a fast-moving start-up with autonomous driving technology and the ability to build a ...,https://www.fool.com/investing/2021/06/25/a-5-billion-boost-autonomous-vehicles/,"data:image/gif;base64,R0lGODlhAQABAIAAAP///////yH5BAEKAAEALAAAAAABAAEAAAICTAEAOw==",Autonomous vehicles
How Can We Speed Up Autonomous Vehicle Deployment?,Forbes,"Jun 25, 2021",2021-06-25 00:00:00.000000,"Autonomous vehicles (AVs) — which are already being deployed as robotaxis, trucks and delivery robots — are ushering in a revolution in the world of ...",https://www.forbes.com/sites/forbestechcouncil/2021/06/25/how-can-we-speed-up-autonomous-vehicle-deployment/,"data:image/gif;base64,R0lGODlhAQABAIAAAP///////yH5BAEKAAEALAAAAAABAAEAAAICTAEAOw==",Autonomous vehicles
Consumer Trust In Automakers To Develop Autonomous Cars ...,Forbes,"Jun 24, 2021",2021-06-24 00:00:00.000000,"The auto industry and technology companies may be charged up about the development of autonomous vehicles, but a new survey indicates not only has ...",https://www.forbes.com/sites/edgarsten/2021/06/24/consumer-trust-in-automakers-to-develop-autonomous-cars-low-cargurus-study-shows/,"data:image/gif;base64,R0lGODlhAQABAIAAAP///////yH5BAEKAAEALAAAAAABAAEAAAICTAEAOw==",Autonomous vehicles
Major tech and automotive industry players join forces for ...,,"Jun 24, 2021",2021-06-24 00:00:00.000000,“The development of truly automated driving will be better mastered by joint forces of ... industry for the series production of safe autonomous vehicles.,https://www.automotiveworld.com/news-releases/major-tech-and-automotive-industry-players-join-forces-for-automated-driving/,"data:image/gif;base64,R0lGODlhAQABAIAAAP///////yH5BAEKAAEALAAAAAABAAEAAAICTAEAOw==",Autonomous vehicles
New Algorithm Helps Autonomous Vehicles Find Themselves ...,Caltech,"Jun 23, 2021",2021-06-23 00:00:00.000000,"New Algorithm Helps Autonomous Vehicles Find Themselves, Summer or Winter ... Without GPS, autonomous systems get lost easily. Now a new algorithm developed at ...",https://www.caltech.edu/about/news/new-algorithm-helps-autonomous-vehicles-find-themselves-summer-or-winter,"data:image/gif;base64,R0lGODlhAQABAIAAAP///////yH5BAEKAAEALAAAAAABAAEAAAICTAEAOw==",Autonomous vehicles
Driverless cars? Semi-autonomous cars are too dangerous ...,Deseret News,"Jun 23, 2021",2021-06-23 00:00:00.000000,"The road to driverless cars is looking hopeless. It's more dangerous to drive today's semi-autonomous cars than to pilot regular ones, and the future doesn't ...",https://www.deseret.com/opinion/2021/6/23/22537081/road-to-driverless-cars-is-looking-hopeless-tesla-semi-autonomous-dangerous,"data:image/gif;base64,R0lGODlhAQABAIAAAP///////yH5BAEKAAEALAAAAAABAAEAAAICTAEAOw==",Autonomous vehicles
How Amazon-owned Zoox designed its self-driving vehicles to ...,TechCrunch,"Jun 22, 2021",2021-06-22 00:00:00.000000,"The hubbub surrounding the autonomous vehicle industry often focuses on venture capital rounds, speculation about IPOs and acquisitions.",https://techcrunch.com/2021/06/22/how-amazon-owned-zoox-designed-its-self-driving-vehicles-to-prevent-crashes-and-protect-if-they-do/,"data:image/gif;base64,R0lGODlhAQABAIAAAP///////yH5BAEKAAEALAAAAAABAAEAAAICTAEAOw==",Autonomous vehicles
Autonomous Driving Tech to Overhaul Auto Sector More Than ...,Bloomberg.com,"Jun 22, 2021",2021-06-22 00:00:00.000000,"Volkswagen CEO Sees Autonomy Transforming Cars More Than Electrification · Cars will be 'so different' without driver, Herbert Diess says · Automaker is investing ...",https://www.bloomberg.com/news/articles/2021-06-22/vw-ceo-sees-autonomy-transforming-cars-more-than-electrification,"data:image/gif;base64,R0lGODlhAQABAIAAAP///////yH5BAEKAAEALAAAAAABAAEAAAICTAEAOw==",Autonomous vehicles
Autonomous vehicles: When will they arrive?,PropertyCasualty360,"Jun 22, 2021",2021-06-22 00:00:00.000000,Autonomous vehicles: When will they arrive? How self-driving cars affect liability assignment will be the top question for insurers to answer. By Christine G.,https://www.propertycasualty360.com/2021/06/22/autonomous-vehicles-when-will-they-arrive/,"data:image/gif;base64,R0lGODlhAQABAIAAAP///////yH5BAEKAAEALAAAAAABAAEAAAICTAEAOw==",Autonomous vehicles
How Do Self-driving Cars Work?,Bankrate,"Jun 22, 2021",2021-06-22 00:00:00.000000,"Self-driving cars use advanced vehicle safety technologies through computers, electronics and sensors to drive themselves. Also called autonomous vehicles, ...",https://www.bankrate.com/insurance/car/how-do-self-driving-cars-work/,"data:image/gif;base64,R0lGODlhAQABAIAAAP///////yH5BAEKAAEALAAAAAABAAEAAAICTAEAOw==",Autonomous vehicles
4 new advances on the road to autonomous driving,Silicon Republic,"Jun 22, 2021",2021-06-22 00:00:00.000000,A graphic image of two self-driving cars following an automated path. Image: © temp-64GTX/Stock.adobe.com. Take a look at some recent developments ...,https://www.siliconrepublic.com/machines/autonomous-driving-tesla-ford-amazon-baidu,"data:image/gif;base64,R0lGODlhAQABAIAAAP///////yH5BAEKAAEALAAAAAABAAEAAAICTAEAOw==",Autonomous vehicles
Autonomous vehicles as a “killer app” for AI,Brookings Institution,"Jun 22, 2021",2021-06-22 00:00:00.000000,"Autonomous vehicles (AVs)—vehicles that accelerate, brake, and turn on their own, requiring little or no input from a human driver—may be such a killer app ...",https://www.brookings.edu/research/autonomous-vehicles-as-a-killer-app-for-ai/,"data:image/gif;base64,R0lGODlhAQABAIAAAP///////yH5BAEKAAEALAAAAAABAAEAAAICTAEAOw==",Autonomous vehicles
What It's Like To Drive In Today's Self Driving Cars,Barron's,"Jun 21, 2021",2021-06-21 00:00:00.000000,"Self-driving cars are very cool, powered by technology that will end up as revolutionary to the auto industry as electric vehicles or even the Model T.",https://www.barrons.com/articles/come-take-a-drive-with-us-in-a-self-driving-car-51624295350,"data:image/gif;base64,R0lGODlhAQABAIAAAP///////yH5BAEKAAEALAAAAAABAAEAAAICTAEAOw==",Autonomous vehicles
Amazon Snaps Up Option to Buy Stake in AI Truck-Driving ...,Bloomberg.com,"Jun 21, 2021",2021-06-21 00:00:00.000000,"Amazon.com Inc. has placed an order for 1,000 autonomous driving systems from self-driving truck technology startup Plus and has acquired the option to buy ...",https://www.bloomberg.com/news/articles/2021-06-21/amazon-is-in-talks-to-buy-stake-in-ai-truck-driving-startup-plus,"data:image/gif;base64,R0lGODlhAQABAIAAAP///////yH5BAEKAAEALAAAAAABAAEAAAICTAEAOw==",Autonomous vehicles
Automated versus autonomous driving: Is that truck behind me ...,FreightWaves,"Jun 20, 2021",2021-06-20 00:00:00.000000,"Here's a primer on the levels of autonomous vehicles. ... The vehicle may have some automated driver assistance features, such as cruise control or lane ...",https://www.freightwaves.com/news/automated-versus-autonomous-driving-is-that-truck-behind-me-a-robot,"data:image/gif;base64,R0lGODlhAQABAIAAAP///////yH5BAEKAAEALAAAAAABAAEAAAICTAEAOw==",Autonomous vehicles
First demonstration of Mcity's test concept for highly automated ...,University of Michigan News,"Jun 19, 2021",2021-06-19 00:00:00.000000,"Highly automated vehicles need a different kind of test to prove they are safe before testing moves to public roads, leaders of Mcity at the University of ...",https://news.umich.edu/first-demonstration-of-mcitys-test-concept-for-highly-automated-vehicles-2/,"data:image/gif;base64,R0lGODlhAQABAIAAAP///////yH5BAEKAAEALAAAAAABAAEAAAICTAEAOw==",Autonomous vehicles
Autonomous vehicles need a large-systems approach to safety,The World Economic Forum,"Jun 18, 2021",2021-06-18 00:00:00.000000,"How to define and measure safety is one of the primary challenges to widescale adoption of autonomous vehicles (AVs);; Developers, regulators, ...",https://www.weforum.org/agenda/2021/06/autonomous-vehicles-safety-large-systems-approach/,"data:image/gif;base64,R0lGODlhAQABAIAAAP///////yH5BAEKAAEALAAAAAABAAEAAAICTAEAOw==",Autonomous vehicles
