title,media,date,datetime,desc,link,img,Category
Regulators know teleoperation is key for self-driving vehicles ...,VentureBeat,"Jun 17, 2021",2021-06-17 00:00:00.000000,"Autonomous Driving (AD) is made possible by the harnessing of cutting-edge sensors, advanced computing, and sophisticated algorithms. Nevertheless, while some ...",https://venturebeat.com/2021/06/17/regulators-know-teleoperation-is-a-must-have-for-self-driving-vehicles-to-succeed/,"data:image/gif;base64,R0lGODlhAQABAIAAAP///////yH5BAEKAAEALAAAAAABAAEAAAICTAEAOw==",Autonomous vehicles
Luminar Lays Out a New Vision for Self-Driving Cars,Barron's,"Jun 17, 2021",2021-06-17 00:00:00.000000,Autonomous-driving technology company Luminar Technologies unveiled its “Blade” self-driving sensor architecture Tuesday morning—a blueprint that vehicle ...,https://www.barrons.com/articles/luminar-lays-out-a-new-vision-for-self-driving-cars-51623770402,"data:image/gif;base64,R0lGODlhAQABAIAAAP///////yH5BAEKAAEALAAAAAABAAEAAAICTAEAOw==",Autonomous vehicles
Why we still don't have self-driving cars on the roads in 2021,The Conversation,"Jun 16, 2021",2021-06-16 00:00:00.000000,Do you remember the time when self-driving cars were upon us? It was almost a decade ago when the Autonomous Vehicle division at Google (now Waymo) promised ...,https://theconversation.com/why-we-still-dont-have-self-driving-cars-on-the-roads-in-2021-162646,"data:image/gif;base64,R0lGODlhAQABAIAAAP///////yH5BAEKAAEALAAAAAABAAEAAAICTAEAOw==",Autonomous vehicles
"U.S. push for self-driving cars faces union, lawyers opposition",Reuters,"Jun 16, 2021",2021-06-16 00:00:00.000000,"WASHINGTON, June 16 (Reuters) - The U.S. Senate Commerce Committee on Wednesday again rejected attempts to lift regulations to allow for the deployment of ...",https://www.reuters.com/business/autos-transportation/us-push-self-driving-cars-faces-union-lawyers-opposition-2021-06-16/,"data:image/gif;base64,R0lGODlhAQABAIAAAP///////yH5BAEKAAEALAAAAAABAAEAAAICTAEAOw==",Autonomous vehicles
Opinion: You will not be traveling in a self-driving car anytime ...,MarketWatch,"Jun 16, 2021",2021-06-16 00:00:00.000000,It will take many years for researchers to optimize autonomous driving. Those improvements can't be rushed. A driver using a hands-free self-driving system.,https://www.marketwatch.com/story/you-will-not-be-traveling-in-a-self-driving-car-anytime-soon-heres-what-the-future-will-look-like-11623866219,"data:image/gif;base64,R0lGODlhAQABAIAAAP///////yH5BAEKAAEALAAAAAABAAEAAAICTAEAOw==",Autonomous vehicles
Waymo raises further $2.5bn for self-driving car project,Financial Times,"Jun 16, 2021",2021-06-16 00:00:00.000000,"Sign up to myFT Daily Digest to be the first to know about Waymo LLC news. Waymo has raised an additional $2.5bn, as an array of investors continued to back its ...",https://www.ft.com/content/e0dd4302-c69f-42b6-8a37-549ce113a885,"data:image/gif;base64,R0lGODlhAQABAIAAAP///////yH5BAEKAAEALAAAAAABAAEAAAICTAEAOw==",Autonomous vehicles
GM ups spending on EVs and autonomous vehicles to $35 ...,CNBC,"Jun 16, 2021",2021-06-16 00:00:00.000000,"GM will increase spending on electric and autonomous vehicles to $35 billion through 2025, a 30% increase from plans announced late last year.",https://www.cnbc.com/2021/06/16/gm-ups-spending-on-evs-and-autonomous-vehicles-to-35-billion-by-2025.html,"data:image/gif;base64,R0lGODlhAQABAIAAAP///////yH5BAEKAAEALAAAAAABAAEAAAICTAEAOw==",Autonomous vehicles
Huawei wants to have autonomous cars on roads by 2025,IoT Tech News,"Jun 14, 2021",2021-06-14 00:00:00.000000,"“Our team's goal is to reach true driverless passenger cars in 2025,” said Wang Jun, a senior executive at Huawei's smart vehicle unit. Huawei has increasingly ...",https://iottechnews.com/news/2021/jun/14/huawei-wants-to-have-autonomous-cars-on-roads-by-2025/,"data:image/gif;base64,R0lGODlhAQABAIAAAP///////yH5BAEKAAEALAAAAAABAAEAAAICTAEAOw==",Autonomous vehicles
An Amazon.com for Self-Driving Data,Bloomberg.com,"Jun 14, 2021",2021-06-14 00:00:00.000000,"Welcome to the Hyperdrive daily briefing, decoding the revolution reshaping the auto world, from EVs to self-driving cars and beyond.",https://www.bloomberg.com/news/newsletters/2021-06-14/an-amazon-com-for-self-driving-data,"data:image/gif;base64,R0lGODlhAQABAIAAAP///////yH5BAEKAAEALAAAAAABAAEAAAICTAEAOw==",Autonomous vehicles
What would you pay for autonomous driving? Volkswagen ...,Ars Technica,"Jun 11, 2021",2021-06-11 00:00:00.000000,What would you pay for autonomous driving? Volkswagen hopes $8.50 per hour. Automaker also plans to offer video games that drivers can play while charging. Tim ...,https://arstechnica.com/cars/2021/06/volkswagen-plans-to-offer-subscriptions-for-autonomous-driving-extra-ev-range/,"data:image/gif;base64,R0lGODlhAQABAIAAAP///////yH5BAEKAAEALAAAAAABAAEAAAICTAEAOw==",Autonomous vehicles
The Future Of Autonomous Vehicles: Product Or Service?,Forbes,"Jun 11, 2021",2021-06-11 00:00:00.000000,"The answer pits the ideas of some traditional automakers, such as GM and others, against companies such as Waymo, Didi or AutoX. As the autonomous driving ...",https://www.forbes.com/sites/enriquedans/2021/06/11/the-future-of-autonomous-vehicles-product-orservice/,"data:image/gif;base64,R0lGODlhAQABAIAAAP///////yH5BAEKAAEALAAAAAABAAEAAAICTAEAOw==",Autonomous vehicles
NVIDIA to buy autonomous vehicle mapping company DeepMap,Engadget,"Jun 11, 2021",2021-06-11 00:00:00.000000,"NVIDIA points out that maps accurate to within a few meters are fine for turn-by-turn GPS directions, but autonomous vehicles require greater accuracy.",https://www.engadget.com/nvidia-acquires-high-definition-mapping-startup-deep-map-110512963.html,"data:image/gif;base64,R0lGODlhAQABAIAAAP///////yH5BAEKAAEALAAAAAABAAEAAAICTAEAOw==",Autonomous vehicles
Autonomous vehicles: the converging factor for private and ...,Automotive World,"Jun 11, 2021",2021-06-11 00:00:00.000000,Autonomous vehicles are one of the key pillars of smart city projects. ... The new German draft bill on autonomous driving demonstrates just how closely ...,https://www.automotiveworld.com/articles/autonomous-vehicles-the-converging-factor-for-private-and-public-actors-in-smart-cities/,"data:image/gif;base64,R0lGODlhAQABAIAAAP///////yH5BAEKAAEALAAAAAABAAEAAAICTAEAOw==",Autonomous vehicles
"Trust in safety of autonomous vehicles still low, but future ...",E&T Magazine,"Jun 10, 2021",2021-06-10 00:00:00.000000,"Meanwhile, Tesla – known for the controversial semi-autonomous Autopilot driving mode in its cars – has been rated the number one luxury dream car for people ...",https://eandt.theiet.org/content/articles/2021/06/trust-in-safety-of-autonomous-vehicles-still-low-but-future-prospects-more-promising/,"data:image/gif;base64,R0lGODlhAQABAIAAAP///////yH5BAEKAAEALAAAAAABAAEAAAICTAEAOw==",Autonomous vehicles
3 in 10 Americans prefer sharks to autonomous vehicles,TheNextWeb,"Jun 9, 2021",2021-06-09 00:00:00.000000,3 in 10 Americans would rather swim with sharks than ride an autonomous vehicle. A study finds that Americans are still very wary of self-driving vehicles.,https://thenextweb.com/news/34-percent-americans-would-rather-swim-with-sharks-than-ride-autonomous-vehicle,"data:image/gif;base64,R0lGODlhAQABAIAAAP///////yH5BAEKAAEALAAAAAABAAEAAAICTAEAOw==",Autonomous vehicles
Will your autonomous car abandon you if you miss payments?,TheNextWeb,"Jun 9, 2021",2021-06-09 00:00:00.000000,Technological barriers. One of the most significant barriers to automatic repo is self-driving cars' biggest obstacle as a whole: technology. Today's autonomous ...,https://thenextweb.com/news/autonomous-self-driving-cars-repossess-syndication,"data:image/gif;base64,R0lGODlhAQABAIAAAP///////yH5BAEKAAEALAAAAAABAAEAAAICTAEAOw==",Autonomous vehicles
Volkswagen weighs autonomous driving from 7 euros an hour,Reuters,"Jun 9, 2021",2021-06-09 00:00:00.000000,"""Regarding autonomous driving we can imagine to offer it on an hourly basis,"" Klaus Zellmer, in charge of sales, marketing and after-sales at the Volkswagen ...",https://www.reuters.com/business/autos-transportation/volkswagen-weighs-autonomous-driving-7-euros-an-hour-2021-06-08/,"data:image/gif;base64,R0lGODlhAQABAIAAAP///////yH5BAEKAAEALAAAAAABAAEAAAICTAEAOw==",Autonomous vehicles
ISEE Launches Autonomous Driving Solution for Yard Trucks ...,Business Wire,"Jun 8, 2021",2021-06-08 00:00:00.000000,"“Unlike other autonomous vehicle solutions, ISEE AI anticipates ... human driven vehicles without disruption,” said Yibiao Zhao, Co-Founder & CEO of ISEE.",https://www.businesswire.com/news/home/20210608005929/en/ISEE-Launches-Autonomous-Driving-Solution-for-Yard-Trucks-to-Optimize-Logistics-Hub-and-Warehouse-Efficiency,"data:image/gif;base64,R0lGODlhAQABAIAAAP///////yH5BAEKAAEALAAAAAABAAEAAAICTAEAOw==",Autonomous vehicles
"Waabi, the rare autonomous vehicle startup with a woman ...",The Verge,"Jun 8, 2021",2021-06-08 00:00:00.000000,"Waabi is a new autonomous vehicle startup with a few things going for it to help it rise above the fray. For one, it's founded by Raquel Urtasun, a renowned ...",https://www.theverge.com/2021/6/8/22522824/waabi-raquel-urtasun-autonomous-vehicle-startup-stealth-funding,"data:image/gif;base64,R0lGODlhAQABAIAAAP///////yH5BAEKAAEALAAAAAABAAEAAAICTAEAOw==",Autonomous vehicles
Why the dream of truly driverless cars is slowly dying,TheNextWeb,"Jun 7, 2021",2021-06-07 00:00:00.000000,We were told there'd be fully-autonomous vehicles dominating roadways across the globe ... Driverless vehicle technology is a difficult challenge to solve.,https://thenextweb.com/news/why-truly-driverless-cars-may-never-happen,"data:image/gif;base64,R0lGODlhAQABAIAAAP///////yH5BAEKAAEALAAAAAABAAEAAAICTAEAOw==",Autonomous vehicles
Autonomous vehicle makers help fight COVID-19 in Guangzhou,Global Times,"Jun 7, 2021",2021-06-07 00:00:00.000000,"Pony.ai, a Chinese autonomous driving start-up, also known as the domestic answer to Google-backed self-driving start-up Waymo, dispatched 14 vehicles to ...",https://www.globaltimes.cn/page/202106/1225556.shtml,"data:image/gif;base64,R0lGODlhAQABAIAAAP///////yH5BAEKAAEALAAAAAABAAEAAAICTAEAOw==",Autonomous vehicles
Autonomous vehicle startup Aurora in final talks to merge with ...,TechCrunch,"Jun 6, 2021",2021-06-06 00:00:00.000000,"Autonomous vehicle startup Aurora is close to finalizing a deal to merge with Reinvent Technology Partners Y, the newest special purpose acquisition company ...",https://techcrunch.com/2021/06/04/autonomous-vehicle-startup-aurora-in-final-talks-to-merge-with-reid-hoffmans-newest-spac/,"data:image/gif;base64,R0lGODlhAQABAIAAAP///////yH5BAEKAAEALAAAAAABAAEAAAICTAEAOw==",Autonomous vehicles
"Self-Driving Cars Could Be Decades Away, No Matter What ...",The Wall Street Journal,"Jun 5, 2021",2021-06-05 00:00:00.000000,"Self-Driving Cars Could Be Decades Away, No Matter What Elon Musk Said. Experts aren't sure when, if ever, we'll have truly autonomous vehicles that can drive ...",https://www.wsj.com/articles/self-driving-cars-could-be-decades-away-no-matter-what-elon-musk-said-11622865615,"data:image/gif;base64,R0lGODlhAQABAIAAAP///////yH5BAEKAAEALAAAAAABAAEAAAICTAEAOw==",Autonomous vehicles
"Aurora brings in outsiders to boost safety efforts, public trust of ...",TechCrunch,"Jun 4, 2021",2021-06-04 00:00:00.000000,"Aurora, the autonomous vehicle company that acquired Uber ATG last year, ... said the goal is for driverless vehicles — whether that's robotaxis shuttling ...",https://techcrunch.com/2021/06/03/aurora-brings-in-outsiders-to-boost-safety-efforts-public-trust-of-driverless-vehicles/,"data:image/gif;base64,R0lGODlhAQABAIAAAP///////yH5BAEKAAEALAAAAAABAAEAAAICTAEAOw==",Autonomous vehicles
The success of self-driving vehicles will depend on teleoperation,VentureBeat,"Jun 3, 2021",2021-06-03 00:00:00.000000,And it's not just because people are gun-shy when it comes to tooling around in a driverless car. An empty driver's seat is perhaps all fine and well on a ...,https://venturebeat.com/2021/06/03/the-success-of-self-driving-vehicles-will-depend-on-teleoperation/,"data:image/gif;base64,R0lGODlhAQABAIAAAP///////yH5BAEKAAEALAAAAAABAAEAAAICTAEAOw==",Autonomous vehicles
Aviva to launch autonomous vehicle trial on public roads in UK,Computer Weekly,"Jun 3, 2021",2021-06-03 00:00:00.000000,The laboratory enables companies to explore next-generation connectivity for connected and autonomous vehicles (CAVs) using both 5G and satellite ...,https://www.computerweekly.com/news/252501867/Aviva-to-launch-autonomous-vehicle-trial-on-public-roads-in-UK,"data:image/gif;base64,R0lGODlhAQABAIAAAP///////yH5BAEKAAEALAAAAAABAAEAAAICTAEAOw==",Autonomous vehicles
Xiaomi-Backed Fund Invests in Autonomous Driving Startup ...,Bloomberg.com,"Jun 3, 2021",2021-06-03 00:00:00.000000,An investment fund backed by Xiaomi Corp. is among a new slew of investors in Zongmu Technology Shanghai Co. as the Chinese autonomous driving system ...,https://www.bloomberg.com/news/articles/2021-06-03/xiaomi-backed-fund-invests-in-autonomous-driving-startup-zongmu,"data:image/gif;base64,R0lGODlhAQABAIAAAP///////yH5BAEKAAEALAAAAAABAAEAAAICTAEAOw==",Autonomous vehicles
Apple Loses Multiple Top Managers From Self-Driving Car ...,Bloomberg.com,"Jun 2, 2021",2021-06-02 00:00:00.000000,Company sees at least three departures from top of car group · Apple has begun early work on an autonomous electric vehicle.,https://www.bloomberg.com/news/articles/2021-06-02/apple-loses-several-top-managers-from-self-driving-car-division,"data:image/gif;base64,R0lGODlhAQABAIAAAP///////yH5BAEKAAEALAAAAAABAAEAAAICTAEAOw==",Autonomous vehicles
Autonomous driving: Closer than you think?,Electric Autonomy Canada,"Jun 2, 2021",2021-06-02 00:00:00.000000,"Accidents that occur with auto-pilot engaged make headlines, but with the number and reach of autonomous vehicle trials spreading, more global jurisdictions ...",https://electricautonomy.ca/2021/06/01/autonomous-driving-canada/,"data:image/gif;base64,R0lGODlhAQABAIAAAP///////yH5BAEKAAEALAAAAAABAAEAAAICTAEAOw==",Autonomous vehicles
Cruise urges Biden to back autonomous vehicle deployment ...,Reuters,"Jun 1, 2021",2021-06-01 00:00:00.000000,"An attendee takes a selfie inside a Cruise Origin autonomous vehicle, a Honda and General Motors self-driving car partnership, during its unveiling in San ...",https://www.reuters.com/business/autos-transportation/cruise-urges-biden-back-autonomous-vehicle-deployment-boost-2021-06-01/,"data:image/gif;base64,R0lGODlhAQABAIAAAP///////yH5BAEKAAEALAAAAAABAAEAAAICTAEAOw==",Autonomous vehicles
Cheaper lidar sensors brighten the future of autonomous cars,Nikkei Asia,"May 30, 2021",2021-05-30 00:00:00.000000,"A Velodyne lidar sensor on an autonomous test vehicle in California, right, and illustrations of Luminar's lidar on a robot taxi, top left (Reuters), ...",https://asia.nikkei.com/Business/Automobiles/Cheaper-lidar-sensors-brighten-the-future-of-autonomous-cars,"data:image/gif;base64,R0lGODlhAQABAIAAAP///////yH5BAEKAAEALAAAAAABAAEAAAICTAEAOw==",Autonomous vehicles
Hacking and loss of driving skills are major consumer ...,,"May 28, 2021",2021-05-28 00:00:00.000000,Summary: A new study has revealed the three primary risks and benefits perceived by consumers towards autonomous vehicles (self-driving cars). Share:.,https://www.sciencedaily.com/releases/2021/05/210526093059.htm,"data:image/gif;base64,R0lGODlhAQABAIAAAP///////yH5BAEKAAEALAAAAAABAAEAAAICTAEAOw==",Autonomous vehicles
Mapping the most important companies in autonomous ...,TheNextWeb,"May 28, 2021",2021-05-28 00:00:00.000000,"If you have a look on the investment side, the autonomous driving space is seeing ... simulation and mapping, autonomous vehicle integrations and software.",https://thenextweb.com/news/global-autonomous-driving-network-making-progress-syndication,"data:image/gif;base64,R0lGODlhAQABAIAAAP///////yH5BAEKAAEALAAAAAABAAEAAAICTAEAOw==",Autonomous vehicles
Self-driving vehicles to be trialled in Cambridge,BBC,"May 27, 2021",2021-05-27 00:00:00.000000,"Although the driving will be automated, a safety operator will be in the ... the perfect environment to trial autonomous vehicles"", the project team said.",https://www.bbc.com/news/uk-england-cambridgeshire-57266371,"data:image/gif;base64,R0lGODlhAQABAIAAAP///////yH5BAEKAAEALAAAAAABAAEAAAICTAEAOw==",Autonomous vehicles
"When Driving Is (Partially) Automated, People Drive More",WIRED,"May 27, 2021",2021-05-27 00:00:00.000000,"When Driving Is (Partially) Automated, People Drive More. A study finds that users of advanced driver-assistance systems drive 4,888 more miles per year than ...",https://www.wired.com/story/driving-partially-automated-people-drive-more/,"data:image/gif;base64,R0lGODlhAQABAIAAAP///////yH5BAEKAAEALAAAAAABAAEAAAICTAEAOw==",Autonomous vehicles
FLIP. First fully autonomous vehicle by SberAutoTech,PR Newswire,"May 27, 2021",2021-05-27 00:00:00.000000,"MOSCOW, May 27, 2021 /PRNewswire/ -- SberAutoTech, a Sber ecosystem company, has revealed a prototype of its own autonomous vehicle for future mobility, ...",https://www.prnewswire.com/news-releases/flip-first-fully-autonomous-vehicle-by-sberautotech-301300516.html,"data:image/gif;base64,R0lGODlhAQABAIAAAP///////yH5BAEKAAEALAAAAAABAAEAAAICTAEAOw==",Autonomous vehicles
"Light is the key to long-range, fully autonomous EVs",TechCrunch,"May 27, 2021",2021-05-27 00:00:00.000000,"At times, the headlines about the autonomous vehicle (AV) industry seem ominous, ... 7.3 million vehicles (7% of the total market) will have autonomous ...",https://techcrunch.com/2021/05/24/light-is-the-key-to-long-range-fully-autonomous-evs/,"data:image/gif;base64,R0lGODlhAQABAIAAAP///////yH5BAEKAAEALAAAAAABAAEAAAICTAEAOw==",Autonomous vehicles
Self-driving truck startup Kodiak partnering with SK Group to ...,TechCrunch,"May 26, 2021",2021-05-26 00:00:00.000000,"Kodiak Robotics, the U.S.-based self-driving truck startup, is partnering with ... the possibility of deploying its autonomous vehicle technology in Asia.",https://techcrunch.com/2021/05/26/self-driving-truck-startup-kodiak-partnering-with-sk-group-to-expand-into-asia/,"data:image/gif;base64,R0lGODlhAQABAIAAAP///////yH5BAEKAAEALAAAAAABAAEAAAICTAEAOw==",Autonomous vehicles
Apple Seeks To Bite Into Self-Driving Electric Vehicle Market,Forbes,"May 26, 2021",2021-05-26 00:00:00.000000,Should automated electric vehicles (EVs) begin to perform the same functions ... The competition to produce and invest in autonomous vehicle technology is ...,https://www.forbes.com/sites/arielcohen/2021/05/26/apple-seeks-to-bite-into-self-driving-electric-vehicle-market/,"data:image/gif;base64,R0lGODlhAQABAIAAAP///////yH5BAEKAAEALAAAAAABAAEAAAICTAEAOw==",Autonomous vehicles
Grand Rapids gets new autonomous cars for free rides,WOODTV.com,"May 25, 2021",2021-05-25 00:00:00.000000,These new May Mobility autonomous vehicles have been on the street for a little more than a week. It's an upgrade from the former white vehicle that was ...,https://www.woodtv.com/news/grand-rapids/grand-rapids-gets-new-autonomous-cars-for-free-rides/,"data:image/gif;base64,R0lGODlhAQABAIAAAP///////yH5BAEKAAEALAAAAAABAAEAAAICTAEAOw==",Autonomous vehicles
The Costly Pursuit of Self-Driving Cars Continues On. And On ...,The New York Times,"May 25, 2021",2021-05-25 00:00:00.000000,"In October, Waymo reached a notable milestone: It started the world's first “fully autonomous” taxi service. In the suburbs of Phoenix, anyone can now ride in a ...",https://www.nytimes.com/2021/05/24/technology/self-driving-cars-wait.html,"data:image/gif;base64,R0lGODlhAQABAIAAAP///////yH5BAEKAAEALAAAAAABAAEAAAICTAEAOw==",Autonomous vehicles
Opinion: It's time for Elon Musk to start telling the truth about ...,MarketWatch,"May 25, 2021",2021-05-25 00:00:00.000000,"The Tesla CEO for years has made exaggerated claims about the potential of autonomous driving, but a spate of suspicious collisions, ...",https://www.marketwatch.com/story/its-time-for-elon-musk-to-start-telling-the-truth-about-autonomous-driving-11621958761,"data:image/gif;base64,R0lGODlhAQABAIAAAP///////yH5BAEKAAEALAAAAAABAAEAAAICTAEAOw==",Autonomous vehicles
Op-ed: Alphabet's Waymo warns that describing vehicles as ...,CNBC,"May 25, 2021",2021-05-25 00:00:00.000000,"Some vehicles sold to the public and marketed as fully self-driving have features known as advanced driver-assistance systems (ADAS)—which, by design, perform ...",https://www.cnbc.com/2021/05/25/op-ed-waymo-warns-misusing-term-self-driving-can-be-unsafe.html,"data:image/gif;base64,R0lGODlhAQABAIAAAP///////yH5BAEKAAEALAAAAAABAAEAAAICTAEAOw==",Autonomous vehicles
Germany gives greenlight to driverless vehicles on public roads,TechCrunch,"May 25, 2021",2021-05-25 00:00:00.000000,"“In the future, autonomous vehicles should be able to drive nationwide without a physically present driver in specified operating areas of public road traffic ...",https://techcrunch.com/2021/05/24/germany-gives-greenlight-to-driverless-vehicles-on-public-roads/,"data:image/gif;base64,R0lGODlhAQABAIAAAP///////yH5BAEKAAEALAAAAAABAAEAAAICTAEAOw==",Autonomous vehicles
Self-driving cars offer chance to re-imagine sound systems,Automotive News Europe,"May 25, 2021",2021-05-25 00:00:00.000000,"Lars Carlsson is vice president of automotive audio for Dirac Research, which specializes in digital audio optimization solutions for automakers such as Bentley ...",https://europe.autonews.com/guest-columnist/self-driving-cars-offer-chance-re-imagine-sound-systems,"data:image/gif;base64,R0lGODlhAQABAIAAAP///////yH5BAEKAAEALAAAAAABAAEAAAICTAEAOw==",Autonomous vehicles
Debate Over Liability Holds Up Self-Driving Car Legislation in ...,Insurance Journal,"May 24, 2021",2021-05-24 00:00:00.000000,They expressed concern that automated vehicles may someday be operated by Uber or other companies and come with clauses to their terms of service. “Unless ...,https://www.insurancejournal.com/news/national/2021/05/24/615521.htm,"data:image/gif;base64,R0lGODlhAQABAIAAAP///////yH5BAEKAAEALAAAAAABAAEAAAICTAEAOw==",Autonomous vehicles
Germany takes step toward autonomous driving on public roads,Automotive News Europe,"May 23, 2021",2021-05-23 00:00:00.000000,"The legislation allows for Level 4 autonomy -- meaning a vehicle that can drive itself under certain conditions. For a car to qualify, Germany requires that a ...",https://europe.autonews.com/automakers/germany-takes-step-toward-autonomous-driving-public-roads,"data:image/gif;base64,R0lGODlhAQABAIAAAP///////yH5BAEKAAEALAAAAAABAAEAAAICTAEAOw==",Autonomous vehicles
Chinese startup Pony.ai gets approval to test driverless ...,The Verge,"May 22, 2021",2021-05-22 00:00:00.000000,Chinese autonomous vehicle startup Pony.ai has received a permit from California's Department of Motor Vehicles to test its driverless cars without human ...,https://www.theverge.com/2021/5/22/22449084/chinese-startup-pony-ai-autonomous-vehicles-california,"data:image/gif;base64,R0lGODlhAQABAIAAAP///////yH5BAEKAAEALAAAAAABAAEAAAICTAEAOw==",Autonomous vehicles
Affordable driverless cars could curb public transit,Popular Science,"May 22, 2021",2021-05-22 00:00:00.000000,"While automation could make driving more energy-efficient, a single autonomous vehicle can't transport as many people as the bus or subway. But since they could ...",https://www.popsci.com/environment/driverless-cars-sustainable/,"data:image/gif;base64,R0lGODlhAQABAIAAAP///////yH5BAEKAAEALAAAAAABAAEAAAICTAEAOw==",Autonomous vehicles
Germany aims to get self-driving cars on the roads in 2022,DW,"May 22, 2021",2021-05-22 00:00:00.000000,German lawmakers greenlit a bill that would allow for some autonomous vehicles to hit public roads as early as next year. But those looking for a driverless ...,https://www.dw.com/en/germany-aims-to-get-self-driving-cars-on-the-roads-in-2022/a-57629028,"data:image/gif;base64,R0lGODlhAQABAIAAAP///////yH5BAEKAAEALAAAAAABAAEAAAICTAEAOw==",Autonomous vehicles
Chinese startup Pony.ai can now test driverless vehicles in ...,TechCrunch,"May 21, 2021",2021-05-21 00:00:00.000000,"The permit issued by the California Department of Motor Vehicles, the agency that regulates automated vehicle testing, expands upon Pony's existing activity in ...",https://techcrunch.com/2021/05/21/chinese-startup-pony-ai-can-now-test-driverless-vehicles-in-three-california-cities/,"data:image/gif;base64,R0lGODlhAQABAIAAAP///////yH5BAEKAAEALAAAAAABAAEAAAICTAEAOw==",Autonomous vehicles
Germany Autonomous Driving on Public Roads Bill Approved ...,Bloomberg.com,"May 21, 2021",2021-05-21 00:00:00.000000,"German lawmakers agreed to allow some driver-less vehicles on public roads, a first step toward enabling autonomous driving in Europe's biggest economy.",https://www.bloomberg.com/news/articles/2021-05-21/germany-takes-step-toward-autonomous-driving-on-public-roads,"data:image/gif;base64,R0lGODlhAQABAIAAAP///////yH5BAEKAAEALAAAAAABAAEAAAICTAEAOw==",Autonomous vehicles
Self-driving cars might never be able to drive themselves,Marketplace.org,"May 21, 2021",2021-05-21 00:00:00.000000,"For a refresher, there are five agreed-upon levels of autonomous driving, where No. 1 is you driving your car with your hands and feet, and No. 5 is the car ...",https://www.marketplace.org/shows/marketplace-tech/self-driving-cars-might-never-drive-themselves,"data:image/gif;base64,R0lGODlhAQABAIAAAP///////yH5BAEKAAEALAAAAAABAAEAAAICTAEAOw==",Autonomous vehicles
