title,media,date,datetime,desc,link,img,Category
Waymo Is 99% of the way to self-driving cars. The last 1% is ...,Autoblog,2 weeks ago,2021-08-21 21:13:51.357431,"Joel Johnson laughs nervously from the backseat when his self-driving taxi stops in the middle of a busy road in suburban Phoenix. The car, operated by ...",https://www.autoblog.com/2021/08/22/waymo-is-99-of-the-way-to-self-driving-cars-the-last-1-is-the-hardest/,"data:image/gif;base64,R0lGODlhAQABAIAAAP///////yH5BAEKAAEALAAAAAABAAEAAAICTAEAOw==",Autonomous vehicles
"Tesla Sells 'Full Self-Driving,' but What Is It Really?",The New York Times,2 weeks ago,2021-08-21 21:13:51.359408,"F.S.D., which can be purchased as an extra on Tesla cars, is a collection of ... For years, Tesla has argued that autonomous vehicles can understand their ...",https://www.nytimes.com/2021/08/20/technology/tesla-full-self-driving-fsd.html,"data:image/gif;base64,R0lGODlhAQABAIAAAP///////yH5BAEKAAEALAAAAAABAAEAAAICTAEAOw==",Autonomous vehicles
Global and China L4 Autonomous Driving Start-ups Report ...,,2 weeks ago,2021-08-21 21:13:51.621470,"Global and China L4 Autonomous Driving Start-ups Report 2021 Featuring 12 International Startups and 13 Chinese Startups. August 20, 2021 05:08 ET | Source: ...",https://www.globenewswire.com/news-release/2021/08/20/2283996/28124/en/Global-and-China-L4-Autonomous-Driving-Start-ups-Report-2021-Featuring-12-International-Startups-and-13-Chinese-Startups.html,"data:image/gif;base64,R0lGODlhAQABAIAAAP///////yH5BAEKAAEALAAAAAABAAEAAAICTAEAOw==",Autonomous vehicles
Waymo's autonomous vehicles have clocked 20 million miles ...,Engadget,2 weeks ago,2021-08-21 21:13:51.623844,"Although other companies that are working on autonomous driving might get more attention, Waymo is still hard at work on the technology.",https://www.engadget.com/waymo-autonomous-vehicles-update-san-francisco-193934150.html,"data:image/gif;base64,R0lGODlhAQABAIAAAP///////yH5BAEKAAEALAAAAAABAAEAAAICTAEAOw==",Autonomous vehicles
Are Autonomous Vehicles Safe for Public Roads? There's a ...,,2 weeks ago,2021-08-21 21:13:51.626092,"Aurora, the Silicon Valley self-driving startup founded by former Tesla, ... tool for evaluating whether and when autonomous trucks and cars are safe to ...",https://www.claimsjournal.com/news/national/2021/08/19/305510.htm,"data:image/gif;base64,R0lGODlhAQABAIAAAP///////yH5BAEKAAEALAAAAAABAAEAAAICTAEAOw==",Autonomous vehicles
Senators ask FTC to investigate Tesla's 'Full Self-Driving ...,The Verge,2 weeks ago,2021-08-21 21:13:51.628229,Senators ask FTC to investigate Tesla's 'Full Self-Driving' promises ... fact that buying that package does not make the company's cars fully autonomous.,https://www.theverge.com/2021/8/18/22630954/markey-blumenthal-ftc-lina-khan-tesla-full-self-driving-musk,"data:image/gif;base64,R0lGODlhAQABAIAAAP///////yH5BAEKAAEALAAAAAABAAEAAAICTAEAOw==",Autonomous vehicles
Waymo is building a hub for its autonomous trucks in Texas,The Verge,2 weeks ago,2021-08-21 21:13:51.630827,"Waymo has a fleet of Peterbilt trucks that have been retrofitted with autonomous driving sensors and software, and it is currently testing them in Arizona, ...",https://www.theverge.com/2021/8/18/22628836/waymo-autonomous-truck-hub-texas-ryder,"data:image/gif;base64,R0lGODlhAQABAIAAAP///////yH5BAEKAAEALAAAAAABAAEAAAICTAEAOw==",Autonomous vehicles
How Google's self-driving car project accidentally spawned its ...,TechCrunch,2 weeks ago,2021-08-21 21:13:51.633701,As Google prepared to spin out its autonomous car tech into the company that ... to take a unique approach to self-driving cars: Road vehicles with all of ...,https://techcrunch.com/2021/08/16/nuro-ec1-origin/,"data:image/gif;base64,R0lGODlhAQABAIAAAP///////yH5BAEKAAEALAAAAAABAAEAAAICTAEAOw==",Autonomous vehicles
Global Semi-Autonomous Vehicle Market Report 2021: Market ...,PR Newswire,2 weeks ago,2021-08-21 21:13:51.635734,"Semi-autonomous cars also promise drivers the ability to practice safer driving over the forecast period, thus driving higher adoption. The availability of ...",https://www.prnewswire.com/news-releases/global-semi-autonomous-vehicle-market-report-2021-market-demand-is-anticipated-to-reach-60-1-million-units-by-2028--exhibiting-a-cagr-of-20-8-301357177.html,"data:image/gif;base64,R0lGODlhAQABAIAAAP///////yH5BAEKAAEALAAAAAABAAEAAAICTAEAOw==",Autonomous vehicles
Deaths caused by Tesla's Autopilot demonstrate the moral ...,Fortune,2 weeks ago,2021-08-21 21:13:51.637730,"Three summers ago, I was on a train heading to the Algarve region of Portugal for a close friend's wedding when, all of a sudden, the vehicle stopped, ...",https://fortune.com/2021/08/17/moral-hazard-self-driving-cars/,"data:image/gif;base64,R0lGODlhAQABAIAAAP///////yH5BAEKAAEALAAAAAABAAEAAAICTAEAOw==",Autonomous vehicles
Global Semi-Autonomous Vehicle Market Analysis Report ...,,2 weeks ago,2021-08-21 21:13:51.639790,"Global Semi-Autonomous Vehicle Market Analysis Report 2021-2028: Level of Automation (Level 1, Level 2, Level 3), & Vehicle Type (Passenger Car, Commercial ...",https://www.businesswire.com/news/home/20210817005747/en/Global-Semi-Autonomous-Vehicle-Market-Analysis-Report-2021-2028-Level-of-Automation-Level-1-Level-2-Level-3-Vehicle-Type-Passenger-Car-Commercial-Vehicle---ResearchAndMarkets.com,"data:image/gif;base64,R0lGODlhAQABAIAAAP///////yH5BAEKAAEALAAAAAABAAEAAAICTAEAOw==",Autonomous vehicles
Meet the self-driving brains working with Volkswagen and Ford,The Verge,2 weeks ago,2021-08-21 21:13:51.641769,"There are still safety drivers in the cars, but it's another small step toward self driving in the US — which, as Bryan points out, is actually trailing behind ...",https://www.theverge.com/22627847/argo-ai-bryan-salesky-decoder-interview-lyft-self-driving,"data:image/gif;base64,R0lGODlhAQABAIAAAP///////yH5BAEKAAEALAAAAAABAAEAAAICTAEAOw==",Autonomous vehicles
Waymo Is 99% of the Way to Self-Driving Cars. The Last 1% Is ...,Bloomberg.com,2 weeks ago,2021-08-21 21:13:52.016270,"Waymo, by most measures, is still the leader of the world's autonomous vehicle effort. Development of its technology began at Google more than a decade ago, and ...",https://www.bloomberg.com/news/articles/2021-08-17/waymo-s-self-driving-cars-are-99-of-the-way-there-the-last-1-is-the-hardest,"data:image/gif;base64,R0lGODlhAQABAIAAAP///////yH5BAEKAAEALAAAAAABAAEAAAICTAEAOw==",Autonomous vehicles
Why regulators love Nuro's self-driving delivery vehicles,TechCrunch,3 weeks ago,2021-08-14 21:13:52.018265,Nuro's delivery autonomous vehicles (AVs) don't have a human driver on board. The company's founders Dave Ferguson (president) and Jiajun Zhu's (CEO) vision ...,https://techcrunch.com/2021/08/16/nuro-ec1-regulations/,"data:image/gif;base64,R0lGODlhAQABAIAAAP///////yH5BAEKAAEALAAAAAABAAEAAAICTAEAOw==",Autonomous vehicles
Can Autonomous Vehicles Drive with Common Sense? - HBS ...,HBS Working Knowledge,3 weeks ago,2021-08-14 21:13:52.020188,Driverless vehicles could improve global health as much as the introduction of penicillin. But consumers won't trust the cars until they behave more like ...,https://hbswk.hbs.edu/item/can-autonomous-vehicles-drive-with-common-sense,"data:image/gif;base64,R0lGODlhAQABAIAAAP///////yH5BAEKAAEALAAAAAABAAEAAAICTAEAOw==",Autonomous vehicles
Autonomous Driving's Missing Link,TechNewsWorld,3 weeks ago,2021-08-14 21:13:52.022136,Autonomous driving now forms the core of most of the efforts to create ... Let's talk about this next phase of making autonomous vehicles massively safer.,https://www.technewsworld.com/story/autonomous-drivings-missing-link-87237.html,"data:image/gif;base64,R0lGODlhAQABAIAAAP///////yH5BAEKAAEALAAAAAABAAEAAAICTAEAOw==",Autonomous vehicles
Nation's largest fleet of autonomous vehicles launches in ...,The Business Journals,3 weeks ago,2021-08-14 21:13:52.024072,"The first of three locations launched Tuesday at Colorado School of Mines with nine driverless, zero-emission EZ10 shuttles. Autonomous Vehicles Colorado (AvCo) ...",https://www.bizjournals.com/denver/news/2021/08/13/colorado-school-of-mines-autonomous-rover-shuttles.html,"data:image/gif;base64,R0lGODlhAQABAIAAAP///////yH5BAEKAAEALAAAAAABAAEAAAICTAEAOw==",Autonomous vehicles
Self-Driving Car Company to Test a Second Autonomous ...,Streetsblog NYC,3 weeks ago,2021-08-14 21:13:52.025977,"The new city permit will require companies to self-certify “that their autonomous vehicles will operate more safely than human drivers in New York City,” submit ...",https://nyc.streetsblog.org/2021/08/13/self-driving-car-company-to-test-a-second-autonomous-vehicle-in-nyc/,"data:image/gif;base64,R0lGODlhAQABAIAAAP///////yH5BAEKAAEALAAAAAABAAEAAAICTAEAOw==",Autonomous vehicles
Newly Studied 'Poltergeist Attacks' Trick Autonomous Vehicles,Security Intelligence,3 weeks ago,2021-08-14 21:13:52.027904,"Bombarding Self-Driving Cars With Acoustic Signals. To be specific, the poltergeist attack affects the stabilization of images detected by a vehicle. In their ...",https://securityintelligence.com/news/new-poltergeist-attacks-trick-autonomous-vehicles/,"data:image/gif;base64,R0lGODlhAQABAIAAAP///////yH5BAEKAAEALAAAAAABAAEAAAICTAEAOw==",Autonomous vehicles
Every Semi-Autonomous Car Can Be Tricked Into Driving With ...,Road & Track,3 weeks ago,2021-08-14 21:13:52.029804,Every Semi-Autonomous Car Can Be Tricked Into Driving With Nobody at the Wheel. The technology to prevent this has been mandatory in lawn tractors for decades.,https://www.roadandtrack.com/news/a37280387/every-semi-autonomous-car-can-be-tricked-into-driving-with-nobody-at-the-wheel/,"data:image/gif;base64,R0lGODlhAQABAIAAAP///////yH5BAEKAAEALAAAAAABAAEAAAICTAEAOw==",Autonomous vehicles
"AI: From Mobility To Cargo, AI-led Autonomous Vehicles Are ...",Forbes India,3 weeks ago,2021-08-14 21:13:52.031700,"From mobility to cargo, AI-led autonomous vehicles are the future · AI programmes can help distinguish between guard rails or obstacles on the roads, can help in ...",https://www.forbesindia.com/article/ai-special/from-mobility-to-cargo-ailed-autonomous-vehicles-are-the-future/69721/1,"data:image/gif;base64,R0lGODlhAQABAIAAAP///////yH5BAEKAAEALAAAAAABAAEAAAICTAEAOw==",Autonomous vehicles
Autonomous-Vehicle Demo Rides Proposed to Shape Public ...,WardsAuto,3 weeks ago,2021-08-14 21:13:52.033827,"“We need to get butts in the seats” of today's self-driving prototypes, says Mark Rosekind of autonomous vehicle company Zoox. Steve Finlay | Aug 09, 2021. Save.",https://www.wardsauto.com/vehicles/autonomous-vehicle-demo-rides-proposed-shape-public-opinion,"data:image/gif;base64,R0lGODlhAQABAIAAAP///////yH5BAEKAAEALAAAAAABAAEAAAICTAEAOw==",Autonomous vehicles
Nation's largest self-driving electric shuttle network launches,TheHill,3 weeks ago,2021-08-14 21:13:52.335107,"The fleet of nine driverless, zero-emission vehicles will shuttle Colorado School of Mines students and staff, as well as members of the public, ...",https://thehill.com/policy/equilibrium-sustainability/567213-nations-largest-self-driving-electric-shuttle-network,"data:image/gif;base64,R0lGODlhAQABAIAAAP///////yH5BAEKAAEALAAAAAABAAEAAAICTAEAOw==",Autonomous vehicles
Germany takes the lead with a new law on autonomous ...,,3 weeks ago,2021-08-14 21:13:52.336989,Background: What is autonomous driving? (SAE J3016 levels and updated taxonomy) ... “Autonomous” is a popular term commonly used to describe systems that have the ...,https://www.jdsupra.com/legalnews/germany-takes-the-lead-with-a-new-law-7746782/,"data:image/gif;base64,R0lGODlhAQABAIAAAP///////yH5BAEKAAEALAAAAAABAAEAAAICTAEAOw==",Autonomous vehicles
Motional to begin testing autonomous vehicles in LA as part of ...,TechCrunch,3 weeks ago,2021-08-14 21:13:52.338954,"Motional, the autonomous vehicle company born out of a $4 billion joint venture with Aptiv and Hyundai, is expanding its presence in California by opening a ...",https://techcrunch.com/2021/08/10/motional-to-begin-testing-autonomous-vehicles-in-la-as-part-of-california-expansion-plan/,"data:image/gif;base64,R0lGODlhAQABAIAAAP///////yH5BAEKAAEALAAAAAABAAEAAAICTAEAOw==",Autonomous vehicles
"Driverless Cars Are Proving to Be Job Creators, At Least So Far",Bloomberg.com,3 weeks ago,2021-08-14 21:13:52.340879,"Today, autonomous vehicle companies are starting to flesh out plans to commercialize self-driving technology. As they progress, some say many new types of AV ...",https://www.bloomberg.com/news/newsletters/2021-08-10/driverless-cars-are-proving-to-be-job-creators-at-least-so-far,"data:image/gif;base64,R0lGODlhAQABAIAAAP///////yH5BAEKAAEALAAAAAABAAEAAAICTAEAOw==",Autonomous vehicles
New data to support operation of autonomous vehicles ...,Intelligent Transport,3 weeks ago,2021-08-14 21:13:52.342769,The Heriot-Watt University-led Radiate project has published a new dataset that will support the development of autonomous vehicles that can operate safely ...,https://www.intelligenttransport.com/transport-news/127381/autonomous-vehicles-adverse-weather/,"data:image/gif;base64,R0lGODlhAQABAIAAAP///////yH5BAEKAAEALAAAAAABAAEAAAICTAEAOw==",Autonomous vehicles
"No, you won't get self-driving cars anytime soon",Verdict,3 weeks ago,2021-08-14 21:13:52.344667,"AVs with level 1 through 3 autonomy require a human driver and will often co-share the driving task, meaning that human drivers and automation of the car are ...",https://www.verdict.co.uk/the-long-winding-road-to-self-driving-cars/,"data:image/gif;base64,R0lGODlhAQABAIAAAP///////yH5BAEKAAEALAAAAAABAAEAAAICTAEAOw==",Autonomous vehicles
Why high-definition maps are critical for self-driving cars,Axios,3 weeks ago,2021-08-14 21:13:52.346569,"For autonomous vehicles, HD maps do more than just provide a high-def view of the world — they also enable a self-driving car to know precisely where it is, ...",https://www.axios.com/self-driving-cars-digital-maps-a1eced04-e36a-4f11-877a-766beef1bce4.html,"data:image/gif;base64,R0lGODlhAQABAIAAAP///////yH5BAEKAAEALAAAAAABAAEAAAICTAEAOw==",Autonomous vehicles
How Much More Can Autonomous Cars Improve? Waymo!,designnews.com,4 weeks ago,2021-08-07 21:13:52.348508,"The heads of Waymo's autonomous car design teams explain the importance of the user experience. Dan Carney | Aug 09, 2021. The rush toward autonomous vehicles ...",https://www.designnews.com/automotive-engineering/how-much-more-can-autonomous-cars-improve-waymo,"data:image/gif;base64,R0lGODlhAQABAIAAAP///////yH5BAEKAAEALAAAAAABAAEAAAICTAEAOw==",Autonomous vehicles
Ghost raises $100 million for 'breakthrough' in autonomous ...,Robotics & Automation News,4 weeks ago,2021-08-07 21:13:52.350444,"Ghost was founded in 2017 with the belief that driving should not be dangerous. Despite all the technology and features included in modern cars, cars still ...",https://roboticsandautomationnews.com/2021/08/09/ghost-raises-100-million-for-breakthrough-in-autonomous-driving-safety/44553/,"data:image/gif;base64,R0lGODlhAQABAIAAAP///////yH5BAEKAAEALAAAAAABAAEAAAICTAEAOw==",Autonomous vehicles
Honda Takes Step Toward Level 3 Autonomous Driving,WardsAuto,1 month ago,2021-08-04 21:13:52.360290,"In doing so, the automaker stresses the importance of working with regulators who will allow the automated driving systems to function properly.",https://www.wardsauto.com/vehicles/honda-takes-step-toward-level-3-autonomous-driving,"data:image/gif;base64,R0lGODlhAQABAIAAAP///////yH5BAEKAAEALAAAAAABAAEAAAICTAEAOw==",Autonomous vehicles
Will artificial intelligence help autonomous cars make life or ...,The Washington Post,1 month ago,2021-08-04 21:13:52.637426,"Autonomous-driving researchers say the industry is far from deciding how AI chooses who receives the brunt of an oncoming accident. So now many, including Lunn, ...",https://www.washingtonpost.com/technology/2021/08/06/self-driving-ai-death-decisions/,"data:image/gif;base64,R0lGODlhAQABAIAAAP///////yH5BAEKAAEALAAAAAABAAEAAAICTAEAOw==",Autonomous vehicles
Self-Driving Cars: Everything You Need to Know,Kelley Blue Book,1 month ago,2021-08-04 21:13:52.640997,Nissan ProPILOT · Subaru EyeSight · Volvo Pilot Assist · Mercedes-Benz Distronic Plus with Steering Assist · Tesla Autopilot and Full Self-Driving · General Motors ...,https://www.kbb.com/car-advice/self-driving-cars/,"data:image/gif;base64,R0lGODlhAQABAIAAAP///////yH5BAEKAAEALAAAAAABAAEAAAICTAEAOw==",Autonomous vehicles
DOT moves to regulate self-driving car tests on NYC streets,New York Post,1 month ago,2021-08-04 21:13:52.644497,The de Blasio Administration wants to force companies that road-test self-driving cars on the streets in spots around the five boroughs to apply for permits ...,https://nypost.com/2021/08/03/dot-moves-to-allow-self-driving-car-tests-on-nyc-streets/,"data:image/gif;base64,R0lGODlhAQABAIAAAP///////yH5BAEKAAEALAAAAAABAAEAAAICTAEAOw==",Autonomous vehicles
Argo AI can now offer the public rides in its autonomous ...,TechCrunch,1 month ago,2021-08-04 21:13:52.647847,"Argo AI, the autonomous vehicle technology startup backed by Ford and VW, has landed a permit in California that will allow the company to give people free ...",https://techcrunch.com/2021/07/30/argo-ai-can-now-offer-the-public-rides-in-its-autonomous-vehicles-in-california/,"data:image/gif;base64,R0lGODlhAQABAIAAAP///////yH5BAEKAAEALAAAAAABAAEAAAICTAEAOw==",Autonomous vehicles
"AI Self-Driving Cars Telling You To Keep Your Hands, Feet ...",Forbes,1 month ago,2021-08-04 21:13:52.651066,"As a clarification, true self-driving cars are ones that the AI drives the car entirely on its own and there isn't any human assistance during the driving task.",https://www.forbes.com/sites/lanceeliot/2021/08/01/self-driving-cars-telling-you-to-keep-your-hands-feet-and-head-inside-the-vehicle-at-all-times/,"data:image/gif;base64,R0lGODlhAQABAIAAAP///////yH5BAEKAAEALAAAAAABAAEAAAICTAEAOw==",Autonomous vehicles
The HD maps for autonomous vehicles market is estimated to ...,Yahoo Finance,1 month ago,2021-08-04 21:13:52.654588,The promising market for self-driving car renting services and increased investments in autonomous driving technology startups are expected to boost the HD maps ...,https://finance.yahoo.com/news/hd-maps-autonomous-vehicles-market-083800356.html,"data:image/gif;base64,R0lGODlhAQABAIAAAP///////yH5BAEKAAEALAAAAAABAAEAAAICTAEAOw==",Autonomous vehicles
Algorithm Could Improve How Self-Driving Cars Take on ...,Nextgov,1 month ago,2021-08-04 21:13:52.658141,"Autonomous vehicles have been heralded as a potential solution to the last mile challenges of delivery and transportation. But for an AV to deliver a pizza, ...",https://www.nextgov.com/emerging-tech/2021/07/algorithm-could-improve-how-self-driving-cars-take-narrow-streets/184178/,"data:image/gif;base64,R0lGODlhAQABAIAAAP///////yH5BAEKAAEALAAAAAABAAEAAAICTAEAOw==",Autonomous vehicles
Veritasium Wants Driverless Cars On The Road ASAP,InsideEVs,1 month ago,2021-08-04 21:13:52.661745,"Tesla has demonstrated that its cars can already drive themselves, although the automaker's Full Self Driving system is still not glitch-free. There are many ...",https://insideevs.com/news/523385/veritasium-video-autonomous-car-waymo/,"data:image/gif;base64,R0lGODlhAQABAIAAAP///////yH5BAEKAAEALAAAAAABAAEAAAICTAEAOw==",Autonomous vehicles
Mobileye First to Test Self-Driving Vehicles in New York City,Transport Topics,1 month ago,2021-08-04 21:13:52.664948,"Mobileye, an autonomous vehicle company owned by Intel, announced that it has been testing its driverless cars on New York City streets since June.",https://www.ttnews.com/articles/mobileye-first-test-self-driving-vehicles-new-york-city,"data:image/gif;base64,R0lGODlhAQABAIAAAP///////yH5BAEKAAEALAAAAAABAAEAAAICTAEAOw==",Autonomous vehicles
Google's Waymo Asks UK Not to Curb Use of Autonomous ...,Business - Insider,1 month ago,2021-08-04 21:13:52.668106,"Waymo, the self-driving vehicles startup owned by Google, has called on the UK government not to impose limits on the number of autonomous cars allowed on ...",https://www.businessinsider.com/googles-waymo-self-driving-autonomous-vehicles-2021-7,"data:image/gif;base64,R0lGODlhAQABAIAAAP///////yH5BAEKAAEALAAAAAABAAEAAAICTAEAOw==",Autonomous vehicles
Trucks Move Past Cars on the Road to Autonomy,WIRED,1 month ago,2021-08-04 21:13:53.139659,"Money is pouring into autonomous trucking startups, just as many are souring on the short-term prospects for self-driving cars.",https://www.wired.com/story/trucks-move-past-cars-road-autonomy/,"data:image/gif;base64,R0lGODlhAQABAIAAAP///////yH5BAEKAAEALAAAAAABAAEAAAICTAEAOw==",Autonomous vehicles
Global and China L4 Autonomous Driving and Start-ups ...,Yahoo Finance,1 month ago,2021-08-04 21:13:53.143202,"As the world's first model of such kind, the car carries 5 cameras, 12 ultrasonic radars and Baidu's autonomous driving computing platform ACU. The AVP solution ...",https://finance.yahoo.com/news/global-china-l4-autonomous-driving-092000184.html,"data:image/gif;base64,R0lGODlhAQABAIAAAP///////yH5BAEKAAEALAAAAAABAAEAAAICTAEAOw==",Autonomous vehicles
The Road Ahead: Examining the Outlook of Regulation for ...,JD Supra,1 month ago,2021-08-04 21:13:53.146790,[co-author: Brianna Jordan]. The market for fully autonomous vehicles is experiencing rapid growth. The global market size of self-driving cars and trucks ...,https://www.jdsupra.com/legalnews/the-road-ahead-examining-the-outlook-of-5847212/,"data:image/gif;base64,R0lGODlhAQABAIAAAP///////yH5BAEKAAEALAAAAAABAAEAAAICTAEAOw==",Autonomous vehicles
Intel sees a growth driver in autonomous cars,Fortune,1 month ago,2021-08-04 21:13:53.150281,"Autonomous car businesses are like lotto tickets for tech companies: The upside is so huge that it's worth some risk and investment, but more often than not ...",https://fortune.com/2021/07/23/intel-sees-a-growth-driver-in-self-driving-cars/,"data:image/gif;base64,R0lGODlhAQABAIAAAP///////yH5BAEKAAEALAAAAAABAAEAAAICTAEAOw==",Autonomous vehicles
"As first autonomous vehicle test hits NYC, driverless cars ...",Staten Island Advance,1 month ago,2021-08-04 21:13:53.153641,"On Tuesday, Mobileye, an autonomous vehicle company owned by Intel, announced that it has been testing its driverless cars on New York City streets for the ...",https://www.silive.com/news/2021/07/as-first-autonomous-vehicle-test-hits-nyc-driverless-cars-navigate-maze-of-pedestrians-double-parked-trucks-and-traffic.html,"data:image/gif;base64,R0lGODlhAQABAIAAAP///////yH5BAEKAAEALAAAAAABAAEAAAICTAEAOw==",Autonomous vehicles
Intel's Mobileye tries out autonomous cars on unpredictable ...,The Washington Post,1 month ago,2021-08-04 21:13:53.157121,"Mobileye received a special permit from New York state, allowing manufacturers of “autonomous vehicle technology” to test on public streets.",https://www.washingtonpost.com/technology/2021/07/22/intel-autonomous-cars-mobileeye/,"data:image/gif;base64,R0lGODlhAQABAIAAAP///////yH5BAEKAAEALAAAAAABAAEAAAICTAEAOw==",Autonomous vehicles
"Ford Teams With Lyft, Argo AI For Self-Driving Ride-Shares ...",Forbes,1 month ago,2021-08-04 21:13:53.160664,"In an “industry-first collaboration,” Ford will launch a program with ride-sharing service Lyft to commercialize autonomous vehicles “at scale.",https://www.forbes.com/wheels/news/ford-lyft-autonomous-vehicle-fleet/,"data:image/gif;base64,R0lGODlhAQABAIAAAP///////yH5BAEKAAEALAAAAAABAAEAAAICTAEAOw==",Autonomous vehicles
Tesla's 'Full Self Driving' Push Is Okay In California—Because ...,Forbes,1 month ago,2021-08-04 21:13:53.164011,"When it comes to Tesla Full Self Driving, or FSD, that assumption is ... “California's autonomous vehicle regulations cover vehicles equipped with ...",https://www.forbes.com/sites/alanohnsman/2021/07/21/teslas-full-self-driving-push-is-okay-in-california-because-its-not-real-self-driving/,"data:image/gif;base64,R0lGODlhAQABAIAAAP///////yH5BAEKAAEALAAAAAABAAEAAAICTAEAOw==",Autonomous vehicles
"When self-driving cars are coming, for real",Yahoo Finance,1 month ago,2021-08-04 21:13:53.167338,"Self-driving features have been creeping into automobiles for years, and Tesla (TSLA) even calls its autonomous system “full self-driving.",https://finance.yahoo.com/news/when-self-driving-cars-are-coming-for-real-164631730.html,"data:image/gif;base64,R0lGODlhAQABAIAAAP///////yH5BAEKAAEALAAAAAABAAEAAAICTAEAOw==",Autonomous vehicles
Self-Driving Cars FAQ: How Far Away Is Far Away?,MotorTrend,1 month ago,2021-08-04 21:13:53.170629,"Cars equipped with Tesla Autopilot, Ford BlueCruise, and GM SuperCruise are NOT self-driving. They may appear to be self-driving, given that you can drive ...",https://www.motortrend.com/news/self-driving-cars-faq-can-i-buy-one/,"data:image/gif;base64,R0lGODlhAQABAIAAAP///////yH5BAEKAAEALAAAAAABAAEAAAICTAEAOw==",Autonomous vehicles
"Argo, Ford to launch self-driving vehicles on Lyft's ride-hailing ...",TechCrunch,1 month ago,2021-08-04 21:13:53.447885,"Autonomous vehicle technology startup Argo AI and its backer and customer Ford plan to launch at least 1,000 self-driving vehicles on Lyft's ride-hailing ...",https://techcrunch.com/2021/07/21/argo-ford-to-launch-self-driving-vehicles-on-lyfts-ride-hailing-app/,"data:image/gif;base64,R0lGODlhAQABAIAAAP///////yH5BAEKAAEALAAAAAABAAEAAAICTAEAOw==",Autonomous vehicles
Ford's self-driving cars will be available on Lyft's platform in ...,The Verge,1 month ago,2021-08-04 21:13:53.451294,"For years, Ford promised that it would launch a full-scale autonomous vehicle business, including robotaxis and driverless delivery, by 2021. That later got ...",https://www.theverge.com/2021/7/21/22585764/ford-argo-lyft-autonomous-vehicles-robotaxi-miami-austin,"data:image/gif;base64,R0lGODlhAQABAIAAAP///////yH5BAEKAAEALAAAAAABAAEAAAICTAEAOw==",Autonomous vehicles
